{
  "date": "2025-04-06",
  "formatted_date": "06/04/2025",
  "day_of_week": "Sunday",
  "sections": {
    "leitura_do_dia": [
      "Leitura do Dia"
    ],
    "primeira_leitura": [
      "Primeira Leitura",
      "Leitura do Livro do Profeta Isaías",
      "43,16-21",
      "Isto diz o Senhor,que abriu uma passagem no mare um caminho entre águas impetuosas;",
      "que pôs a perder carros e cavalos,tropas e homens corajosos;pois estão todos mortos e não ressuscitarão,foram abafados como mecha de pano e apagaram-se:",
      "\"Não relembreis coisas passadas,não olheis para fatos antigos.",
      "Eis que eu farei coisas novas,e que já estão surgindo:",
      "acaso não as reconheceis?Pois abrirei uma estrada no desertoe farei correr rios na terra seca.",
      "Hão de glorificar-me os animais selvagens,os dragões e os avestruzes,porque fiz brotar água no desertoe rios na terra secapara dar de beber a meu povo, a meus escolhidos.",
      "Este povo, eu o criei para mime ele cantará meus louvores\".",
      "Leitura da Carta de São Paulo aos Filipenses",
      "3,8-14",
      "Irmãos:",
      "Na verdade, considero tudo como perdadiante da vantagem supremaque consiste em conhecer a Cristo Jesus, meu Senhor.Por causa dele eu perdi tudo.Considero tudo como lixo,para ganhar Cristo e ser encontrado unido a ele;",
      "não com minha justiça provindo da Lei,mas com a justiça por meio da fé em Cristo,a justiça que vem de Deus, na base da fé.",
      "Esta consiste em conhecer a Cristo,experimentar a força da sua ressurreição,ficar em comunhão com os seus sofrimentos,tornando-me semelhante a ele na sua morte,",
      "para ver se alcanço a ressurreição dentre os mortos.",
      "Não que já tenha recebido tudo isso,ou que já seja perfeito.Mas corro para alcançá-lo,visto que já fui alcançado por Cristo Jesus.",
      "Irmãos, eu não julgo já tê-lo alcançado.Uma coisa, porém, eu faço:esquecendo o que fica para trás,eu me lanço para o que está na frente.",
      "Corro direto para a meta,rumo ao prêmio,que, do alto, Deus me chama a receberem Cristo Jesus."
    ],
    "segunda_leitura": [
      "Segunda Leitura"
    ],
    "evangelho": [
      "Evangelho do Dia",
      "Proclamação do Evangelho de Jesus Cristo segundo João",
      "8,1-11",
      "Naquele tempo,",
      "Jesus foi para o monte das Oliveiras.",
      "De madrugada, voltou de novo ao Templo.Todo o povo se reuniu em volta dele.Sentando-se, começou a ensiná-los.",
      "Entretanto, os mestres da Lei e os fariseustrouxeram uma mulher surpreendida em adultério.Colocando-a no meio deles,",
      "disseram a Jesus:",
      "\"Mestre, esta mulher foi surpreendida em flagrante adultério.",
      "Moisés na Lei mandou apedrejar tais mulheres.Que dizes tu?\"",
      "Perguntavam isso para experimentar Jesuse para terem motivo de o acusar.Mas Jesus, inclinando-se,começou a escrever com o dedo no chão.",
      "Como persistissem em interrogá-lo,Jesus ergueu-se e disse:",
      "\"Quem dentre vós não tiver pecado,seja o primeiro a atirar-lhe uma pedra\".",
      "E tornando a inclinar-se,continuou a escrever no chão.",
      "E eles, ouvindo o que Jesus falou,foram saindo um a um,a começar pelos mais velhos;e Jesus ficou sozinho,com a mulher que estava lá, no meio do povo.",
      "Então Jesus se levantou e disse:\"Mulher, onde estão eles?Ninguém te condenou?\"",
      "Ela respondeu: \"Ninguém, Senhor\".Então Jesus lhe disse:",
      "\"Eu também não te condeno.Podes ir, e de agora em diante não peques mais\"."
    ],
    "palavras_papas": [
      "As palavras dos Papas",
      "E Jesus despede a mulher com estas palavras maravilhosas: «Vai e de agora em diante não tornes a pecar» (v. 11). E assim Jesus abre diante dela um caminho novo, criado pela misericórdia, uma vereda que exige o seu compromisso de não voltar a pecar. Trata-se de um convite válido para cada um de nós: quando nos perdoa, Jesus abre-nos sempre um caminho novo para irmos em frente. Neste tempo de Quaresma, somos chamados a reconhecer-nos pecadores e a pedir perdão a Deus. E o perdão, por sua vez, enquanto nos reconcilia e nos concede a paz, leva-nos a recomeçar uma história renovada. Toda a verdadeira conversão visa um futuro novo, um caminho novo, uma vida boa, uma vida livre do pecado, uma vida generosa. Não tenhamos medo de pedir perdão a Jesus, porque Ele nos abre a porta para esta vida nova. A Virgem Maria nos ajude a testemunhar a todos o amor misericordioso de Deus que, em Jesus, nos perdoa e renova a nossa existência, oferecendo-nos sempre renovadas possibilidades. (Angelus de 7 de abril de 2019)",
      "Outros eventos na programação:"
    ]
  },
  "title": "Palavra do dia",
  "content": "Leitura Do Dia: Leitura do Dia Primeira Leitura: Primeira Leitura Leitura do Livro do Profeta Isaías 43,16-21 Isto diz o Senhor,que abriu uma passagem no mare um caminho entre águas impetuosas; que pôs a perder carros e cavalos,tropas e homens corajosos;pois estão todos mortos e não ressuscitarão,foram abafados como mecha de pano e apagaram-se: \"Não relembreis coisas passadas,não olheis para fatos antigos. Eis que eu farei coisas novas,e que já estão surgindo: acaso não as reconheceis?Pois abrirei uma estrada no desertoe farei correr rios na terra seca. Hão de glorificar-me os animais selvagens,os dragões e os avestruzes,porque fiz brotar água no desertoe rios na terra secapara dar de beber a meu povo, a meus escolhidos. Este povo, eu o criei para mime ele cantará meus louvores\". Leitura da Carta de São Paulo aos Filipenses 3,8-14 Irmãos: Na verdade, considero tudo como perdadiante da vantagem supremaque consiste em conhecer a Cristo Jesus, meu Senhor.Por causa dele eu perdi tudo.Considero tudo como lixo,para ganhar Cristo e ser encontrado unido a ele; não com minha justiça provindo da Lei,mas com a justiça por meio da fé em Cristo,a justiça que vem de Deus, na base da fé. Esta consiste em conhecer a Cristo,experimentar a força da sua ressurreição,ficar em comunhão com os seus sofrimentos,tornando-me semelhante a ele na sua morte, para ver se alcanço a ressurreição dentre os mortos. Não que já tenha recebido tudo isso,ou que já seja perfeito.Mas corro para alcançá-lo,visto que já fui alcançado por Cristo Jesus. Irmãos, eu não julgo já tê-lo alcançado.Uma coisa, porém, eu faço:esquecendo o que fica para trás,eu me lanço para o que está na frente. Corro direto para a meta,rumo ao prêmio,que, do alto, Deus me chama a receberem Cristo Jesus. Segunda Leitura: Segunda Leitura Evangelho: Evangelho do Dia Proclamação do Evangelho de Jesus Cristo segundo João 8,1-11 Naquele tempo, Jesus foi para o monte das Oliveiras. De madrugada, voltou de novo ao Templo.Todo o povo se reuniu em volta dele.Sentando-se, começou a ensiná-los. Entretanto, os mestres da Lei e os fariseustrouxeram uma mulher surpreendida em adultério.Colocando-a no meio deles, disseram a Jesus: \"Mestre, esta mulher foi surpreendida em flagrante adultério. Moisés na Lei mandou apedrejar tais mulheres.Que dizes tu?\" Perguntavam isso para experimentar Jesuse para terem motivo de o acusar.Mas Jesus, inclinando-se,começou a escrever com o dedo no chão. Como persistissem em interrogá-lo,Jesus ergueu-se e disse: \"Quem dentre vós não tiver pecado,seja o primeiro a atirar-lhe uma pedra\". E tornando a inclinar-se,continuou a escrever no chão. E eles, ouvindo o que Jesus falou,foram saindo um a um,a começar pelos mais velhos;e Jesus ficou sozinho,com a mulher que estava lá, no meio do povo. Então Jesus se levantou e disse:\"Mulher, onde estão eles?Ninguém te condenou?\" Ela respondeu: \"Ninguém, Senhor\".Então Jesus lhe disse: \"Eu também não te condeno.Podes ir, e de agora em diante não peques mais\". Palavras Papas: As palavras dos Papas E Jesus despede a mulher com estas palavras maravilhosas: «Vai e de agora em diante não tornes a pecar» (v. 11). E assim Jesus abre diante dela um caminho novo, criado pela misericórdia, uma vereda que exige o seu compromisso de não voltar a pecar. Trata-se de um convite válido para cada um de nós: quando nos perdoa, Jesus abre-nos sempre um caminho novo para irmos em frente. Neste tempo de Quaresma, somos chamados a reconhecer-nos pecadores e a pedir perdão a Deus. E o perdão, por sua vez, enquanto nos reconcilia e nos concede a paz, leva-nos a recomeçar uma história renovada. Toda a verdadeira conversão visa um futuro novo, um caminho novo, uma vida boa, uma vida livre do pecado, uma vida generosa. Não tenhamos medo de pedir perdão a Jesus, porque Ele nos abre a porta para esta vida nova. A Virgem Maria nos ajude a testemunhar a todos o amor misericordioso de Deus que, em Jesus, nos perdoa e renova a nossa existência, oferecendo-nos sempre renovadas possibilidades. (Angelus de 7 de abril de 2019) Outros eventos na programação:"
}