{
  "date": "2025-04-17",
  "formatted_date": "17/04/2025",
  "day_of_week": "Thursday",
  "sections": {
    "leitura_do_dia": [
      "Leitura do Dia",
      "Prima Leitura"
    ],
    "primeira_leitura": [
      "Leitura do Livro do Êxodo",
      "12,1-8.11-14",
      "Naqueles dias,",
      "O Senhor disse a Moisés e a Aarão no Egito:",
      "\"Este mês será para vós o começo dos meses;será o primeiro mês do ano.",
      "Falai a toda a comunidade dos filhos de Israel,dizendo:'No décimo dia deste mês,cada um tome um cordeiro por família,um cordeiro para cada casa.",
      "Se a família não for bastante numerosapara comer um cordeiro,convidará também o vizinho mais próximo,de acordo com o número de pessoas.Deveis calcular o número de comensais,conforme o tamanho do cordeiro.",
      "O cordeiro será sem defeito,macho, de um ano.Podereis escolher tanto um cordeiro, como um cabrito:",
      "e devereis guardá-lo presoaté ao dia catorze deste mês.Então toda a comunidade de Israel reunidao imolará ao cair da tarde.",
      "Tomareis um pouco do seu sanguee untareis os marcos e a travessa da porta,nas casas em que o comerdes.",
      "Comereis a carne nessa mesma noite, assada ao fogo,com pães ázimos e ervas amargas.",
      "Assim devereis comê-lo: com os rins cingidos,sandálias nos pés e cajado na mão.E comereis às pressas, pois é a Páscoa,isto é, a 'Passagem' do Senhor!",
      "E naquela noite passarei pela terra do Egitoe ferirei na terra do Egito todos os primogênitos,desde os homens até os animais;e infligirei castigos contra todos os deuses do Egito,eu, o Senhor.",
      "O sangue servirá de sinal nas casas onde estiverdes.Ao ver o sangue, passarei adiante,e não vos atingirá a praga exterminadora,quando eu ferir a terra do Egito.",
      "Este dia será para vós uma festa memorávelem honra do Senhor,que haveis de celebrar por todas as gerações,como instituição perpétua\"."
    ],
    "segunda_leitura": [
      "Segunda Leitura",
      "Leitura da Primeira Carta de São Paulo aos Coríntios",
      "11,23-26",
      "Irmãos:",
      "O que eu recebi do Senhor,foi isso que eu vos transmiti:Na noite em que foi entregue,o Senhor Jesus tomou o pão",
      "e, depois de dar graças, partiu-o e disse:\"Isto é o meu corpo que é dado por vós.Fazei isto em minha memória\".",
      "Do mesmo modo, depois da ceia,tomou também o cálice e disse:\"Este cálice é a nova aliança, em meu sangue.Todas as vezes que dele beberdes,fazei isto em minha memória\".",
      "Todas as vezes, de fato, que comerdes deste pãoe beberdes deste cálice,estareis proclamando a morte do Senhor,até que ele venha."
    ],
    "evangelho": [
      "Evangelho do Dia",
      "Proclamação do Evangelho de Jesus Cristo segundo João",
      "13,1-15",
      "Era antes da festa da Páscoa.Jesus sabia que tinha chegado a sua horade passar deste mundo para o Pai;tendo amado os seus que estavam no mundo,amou-os até o fim.",
      "Estavam tomando a ceia.O diabo já tinha postono coração de Judas, filho de Simão Iscariotes,o propósito de entregar Jesus.",
      "Jesus, sabendo que o Pai tinha colocado tudo em suas mãose que de Deus tinha saído e para Deus voltava,",
      "levantou-se da mesa, tirou o manto,pegou uma toalha e amarrou-a na cintura.",
      "Derramou água numa baciae começou a lavar os pés dos discípulos,enxugando-os com a toalha com que estava cingido.",
      "Chegou a vez de Simão Pedro.Pedro disse:\"Senhor, tu me lavas os pés?\"",
      "Respondeu Jesus:\"Agora, não entendes o que estou fazendo;mais tarde compreenderás\".",
      "Disse-lhe Pedro:\"Tu nunca me lavarás os pés!\"Mas Jesus respondeu:\"Se eu não te lavar, não terás parte comigo\".",
      "Simão Pedro disse:\"Senhor, então lava não somente os meus pés,mas também as mãos e a cabeça\".",
      "Jesus respondeu:\"Quem já se banhounão precisa lavar senão os pés, porque já está todo limpo.Também vós estais limpos, mas não todos\".",
      "Jesus sabia quem o ia entregar;por isso disse:\"Nem todos estais limpos\".",
      "Depois de ter lavado os pés dos discípulos,Jesus vestiu o manto e sentou-se de novo.E disse aos discípulos:\"Compreendeis o que acabo de fazer?",
      "Vós me chamais Mestre e Senhor,e dizeis bem, pois eu o sou.",
      "Portanto, se eu, o Senhor e Mestre,",
      "vos lavei os pés,também vós deveis lavar os pés uns dos outros.",
      "Dei-vos o exemplo,para que façais a mesma coisa que eu fiz\"."
    ],
    "palavras_papas": [
      "As palavras dos Papas",
      "A realidade que vivemos hoje, nesta celebração. O Senhor quer ficar conosco na Eucaristia, e nós tornamo-nos tabernáculos permanentes do Senhor. Trazemos conosco o Senhor, a ponto de Ele próprio nos dizer que, se não comermos o seu Corpo e não bebermos o seu Sangue, não entraremos no Reino dos Céus. Este é o mistério do Pão e do Vinho, do Senhor conosco, em nós, dentro de nós. O serviço: um procedimento que é condição para entrar no Reino dos Céus. Servir, sim; servir a todos. Mas o Senhor, na troca de palavras que teve com Pedro (cf. Jo 13, 6-9), faz-lhe compreender que, para entrar no Reino dos Céus, devemos deixar que o Senhor nos sirva, que o Servo de Deus seja nosso servo. E isto é difícil de compreender. Se não deixo que o Senhor seja o meu servo, que o Senhor me lave, me faça crescer, me perdoe, não entrarei no Reino dos Céus. E o sacerdócio. Hoje quero estreitar a mim os sacerdotes, todos os sacerdotes, desde o último ordenado até ao Papa. Todos somos sacerdotes. Os bispos, todos... Fomos ungidos, ungidos pelo Senhor; ungidos para fazer a Eucaristia, ungidos para servir. (Homilia na Santa Missa In Coena Domini, 9 de abril de 2020)",
      "Outros eventos na programação:"
    ]
  },
  "title": "Palavra do dia",
  "content": "Leitura Do Dia: Leitura do Dia Prima Leitura Primeira Leitura: Leitura do Livro do Êxodo 12,1-8.11-14 Naqueles dias, O Senhor disse a Moisés e a Aarão no Egito: \"Este mês será para vós o começo dos meses;será o primeiro mês do ano. Falai a toda a comunidade dos filhos de Israel,dizendo:'No décimo dia deste mês,cada um tome um cordeiro por família,um cordeiro para cada casa. Se a família não for bastante numerosapara comer um cordeiro,convidará também o vizinho mais próximo,de acordo com o número de pessoas.Deveis calcular o número de comensais,conforme o tamanho do cordeiro. O cordeiro será sem defeito,macho, de um ano.Podereis escolher tanto um cordeiro, como um cabrito: e devereis guardá-lo presoaté ao dia catorze deste mês.Então toda a comunidade de Israel reunidao imolará ao cair da tarde. Tomareis um pouco do seu sanguee untareis os marcos e a travessa da porta,nas casas em que o comerdes. Comereis a carne nessa mesma noite, assada ao fogo,com pães ázimos e ervas amargas. Assim devereis comê-lo: com os rins cingidos,sandálias nos pés e cajado na mão.E comereis às pressas, pois é a Páscoa,isto é, a 'Passagem' do Senhor! E naquela noite passarei pela terra do Egitoe ferirei na terra do Egito todos os primogênitos,desde os homens até os animais;e infligirei castigos contra todos os deuses do Egito,eu, o Senhor. O sangue servirá de sinal nas casas onde estiverdes.Ao ver o sangue, passarei adiante,e não vos atingirá a praga exterminadora,quando eu ferir a terra do Egito. Este dia será para vós uma festa memorávelem honra do Senhor,que haveis de celebrar por todas as gerações,como instituição perpétua\". Segunda Leitura: Segunda Leitura Leitura da Primeira Carta de São Paulo aos Coríntios 11,23-26 Irmãos: O que eu recebi do Senhor,foi isso que eu vos transmiti:Na noite em que foi entregue,o Senhor Jesus tomou o pão e, depois de dar graças, partiu-o e disse:\"Isto é o meu corpo que é dado por vós.Fazei isto em minha memória\". Do mesmo modo, depois da ceia,tomou também o cálice e disse:\"Este cálice é a nova aliança, em meu sangue.Todas as vezes que dele beberdes,fazei isto em minha memória\". Todas as vezes, de fato, que comerdes deste pãoe beberdes deste cálice,estareis proclamando a morte do Senhor,até que ele venha. Evangelho: Evangelho do Dia Proclamação do Evangelho de Jesus Cristo segundo João 13,1-15 Era antes da festa da Páscoa.Jesus sabia que tinha chegado a sua horade passar deste mundo para o Pai;tendo amado os seus que estavam no mundo,amou-os até o fim. Estavam tomando a ceia.O diabo já tinha postono coração de Judas, filho de Simão Iscariotes,o propósito de entregar Jesus. Jesus, sabendo que o Pai tinha colocado tudo em suas mãose que de Deus tinha saído e para Deus voltava, levantou-se da mesa, tirou o manto,pegou uma toalha e amarrou-a na cintura. Derramou água numa baciae começou a lavar os pés dos discípulos,enxugando-os com a toalha com que estava cingido. Chegou a vez de Simão Pedro.Pedro disse:\"Senhor, tu me lavas os pés?\" Respondeu Jesus:\"Agora, não entendes o que estou fazendo;mais tarde compreenderás\". Disse-lhe Pedro:\"Tu nunca me lavarás os pés!\"Mas Jesus respondeu:\"Se eu não te lavar, não terás parte comigo\". Simão Pedro disse:\"Senhor, então lava não somente os meus pés,mas também as mãos e a cabeça\". Jesus respondeu:\"Quem já se banhounão precisa lavar senão os pés, porque já está todo limpo.Também vós estais limpos, mas não todos\". Jesus sabia quem o ia entregar;por isso disse:\"Nem todos estais limpos\". Depois de ter lavado os pés dos discípulos,Jesus vestiu o manto e sentou-se de novo.E disse aos discípulos:\"Compreendeis o que acabo de fazer? Vós me chamais Mestre e Senhor,e dizeis bem, pois eu o sou. Portanto, se eu, o Senhor e Mestre, vos lavei os pés,também vós deveis lavar os pés uns dos outros. Dei-vos o exemplo,para que façais a mesma coisa que eu fiz\". Palavras Papas: As palavras dos Papas A realidade que vivemos hoje, nesta celebração. O Senhor quer ficar conosco na Eucaristia, e nós tornamo-nos tabernáculos permanentes do Senhor. Trazemos conosco o Senhor, a ponto de Ele próprio nos dizer que, se não comermos o seu Corpo e não bebermos o seu Sangue, não entraremos no Reino dos Céus. Este é o mistério do Pão e do Vinho, do Senhor conosco, em nós, dentro de nós. O serviço: um procedimento que é condição para entrar no Reino dos Céus. Servir, sim; servir a todos. Mas o Senhor, na troca de palavras que teve com Pedro (cf. Jo 13, 6-9), faz-lhe compreender que, para entrar no Reino dos Céus, devemos deixar que o Senhor nos sirva, que o Servo de Deus seja nosso servo. E isto é difícil de compreender. Se não deixo que o Senhor seja o meu servo, que o Senhor me lave, me faça crescer, me perdoe, não entrarei no Reino dos Céus. E o sacerdócio. Hoje quero estreitar a mim os sacerdotes, todos os sacerdotes, desde o último ordenado até ao Papa. Todos somos sacerdotes. Os bispos, todos... Fomos ungidos, ungidos pelo Senhor; ungidos para fazer a Eucaristia, ungidos para servir. (Homilia na Santa Missa In Coena Domini, 9 de abril de 2020) Outros eventos na programação:"
}