{
  "date": "2025-04-20",
  "formatted_date": "20/04/2025",
  "day_of_week": "Sunday",
  "sections": {
    "leitura_do_dia": [
      "Leitura do Dia"
    ],
    "primeira_leitura": [
      "Primeira Leitura",
      "Leitura dos Atos dos Apóstolos",
      "10,34a.37-43",
      "Naqueles dias,",
      "Pedro tomou a palavra e disse:",
      "Vós sabeis o que aconteceu em toda a Judeia,\na começar pela Galileia,\ndepois do batismo pregado por João:",
      "como Jesus de Nazaré foi ungido por Deus\ncom o Espírito Santo e com poder.\nEle andou por toda a parte, fazendo o bem\ne curando a todos os que estavam dominados pelo demônio;",
      "porque Deus estava com ele.",
      "E nós somos testemunhas de tudo o que Jesus fez\nna terra dos judeus e em Jerusalém.\nEles o mataram, pregando-o numa cruz.",
      "Mas Deus o ressuscitou no terceiro dia,\nconcedendo-lhe manifestar-se",
      "não a todo o povo,\nmas às testemunhas que Deus havia escolhido:\na nós, que comemos e bebemos com Jesus,\ndepois que ressuscitou dos mortos.",
      "E Jesus nos mandou pregar ao povo\ne testemunhar que Deus o constituiu\nJuiz dos vivos e dos mortos.",
      "Todos os profetas dão testemunho dele:\n'Todo aquele que crê em Jesus\nrecebe, em seu nome, o perdão dos pecados'\".",
      "Leitura da Carta de São Paulo aos Colossenses",
      "3,1-4",
      "Irmãos:",
      "Se ressuscitastes com Cristo,\nesforçai-vos por alcançar as coisas do alto,",
      "onde está Cristo, sentado à direita de Deus;\naspirai às coisas celestes e não às coisas terrestres.",
      "Pois vós morrestes,\ne a vossa vida está escondida, com Cristo, em Deus.",
      "Quando Cristo, vossa vida, aparecer em seu triunfo,\nentão vós aparecereis também com ele,\nrevestidos de glória."
    ],
    "segunda_leitura": [
      "Segunda Leitura"
    ],
    "evangelho": [
      "Evangelho do Dia",
      "Proclamação do Evangelho de Jesus Cristo segundo João",
      "20,1-9",
      "No primeiro dia da semana,\nMaria Madalena foi ao túmulo de Jesus,\nbem de madrugada, quando ainda estava escuro,\ne viu que a pedra tinha sido retirada do túmulo.",
      "Então ela saiu correndo\ne foi encontrar Simão Pedro e o outro discípulo,\naquele que Jesus amava,\ne lhes disse:",
      "\"Tiraram o Senhor do túmulo,\ne não sabemos onde o colocaram\".",
      "Saíram, então, Pedro e o outro discípulo\ne foram ao túmulo.",
      "Os dois corriam juntos,",
      "mas o outro discípulo correu mais depressa que Pedro\ne chegou primeiro ao túmulo.",
      "Olhando para dentro, viu as faixas de linho no chão,\nmas não entrou.",
      "Chegou também Simão Pedro, que vinha correndo atrás,\ne entrou no túmulo.\nViu as faixas de linho deitadas no chão",
      "e o pano que tinha estado sobre a cabeça de Jesus,\nnão posto com as faixas,\nmas enrolado num lugar à parte.",
      "Então entrou também o outro discípulo,\nque tinha chegado primeiro ao túmulo.\nEle viu, e acreditou.",
      "De fato, eles ainda não tinham compreendido a Escritura,\nsegundo a qual ele devia ressuscitar dos mortos."
    ],
    "palavras_papas": [
      "As palavras dos Papas",
      "Hoje ressoa em todo o mundo o anúncio que partiu de Jerusalém há dois mil anos: \"Jesus de Nazaré, o crucificado, ressuscitou!\" [...] Jesus Cristo ressuscitou, e somente Ele é capaz de remover as pedras que fecham o caminho para a vida. De fato, Ele mesmo, o Vivente, é o Caminho: o Caminho da vida, da paz, da reconciliação, da fraternidade. Ele nos abre a passagem, algo humanamente impossível, porque somente Ele tira o pecado do mundo e perdoa os nossos pecados. E sem o perdão de Deus, essa pedra não pode ser removida. Sem o perdão dos pecados, não se consegue sair dos fechamentos, dos preconceitos, das suspeitas mútuas e das presunções, que sempre levam a absolver a si mesmo e acusar os outros. Somente o Cristo Ressuscitado, ao dar-nos o perdão dos pecados, abre o caminho para um mundo renovado. Somente ele nos abre as portas da vida, aquelas portas que fechamos continuamente com as guerras que se alastram pelo mundo. [...] O túmulo de Jesus está aberto e vazio! É aqui que tudo começa. Através desse túmulo vazio passa o novo caminho, o caminho que nenhum de nós, mas somente Deus, poderia abrir: o caminho da vida em meio à morte, o caminho da paz em meio à guerra, o caminho da reconciliação em meio ao ódio, o caminho da fraternidade em meio à inimizade. (Mensagem Urbi et Orbi da Páscoa de 31 de março de 2024)",
      "Outros eventos na programação:"
    ]
  },
  "title": "Palavra do dia",
  "content": "Leitura Do Dia:\nLeitura do Dia\n\nPrimeira Leitura:\nPrimeira Leitura\nLeitura dos Atos dos Apóstolos\n10,34a.37-43\nNaqueles dias,\nPedro tomou a palavra e disse:\nVós sabeis o que aconteceu em toda a Judeia,\na começar pela Galileia,\ndepois do batismo pregado por João:\ncomo Jesus de Nazaré foi ungido por Deus\ncom o Espírito Santo e com poder.\nEle andou por toda a parte, fazendo o bem\ne curando a todos os que estavam dominados pelo demônio;\nporque Deus estava com ele.\nE nós somos testemunhas de tudo o que Jesus fez\nna terra dos judeus e em Jerusalém.\nEles o mataram, pregando-o numa cruz.\nMas Deus o ressuscitou no terceiro dia,\nconcedendo-lhe manifestar-se\nnão a todo o povo,\nmas às testemunhas que Deus havia escolhido:\na nós, que comemos e bebemos com Jesus,\ndepois que ressuscitou dos mortos.\nE Jesus nos mandou pregar ao povo\ne testemunhar que Deus o constituiu\nJuiz dos vivos e dos mortos.\nTodos os profetas dão testemunho dele:\n'Todo aquele que crê em Jesus\nrecebe, em seu nome, o perdão dos pecados'\".\nLeitura da Carta de São Paulo aos Colossenses\n3,1-4\nIrmãos:\nSe ressuscitastes com Cristo,\nesforçai-vos por alcançar as coisas do alto,\nonde está Cristo, sentado à direita de Deus;\naspirai às coisas celestes e não às coisas terrestres.\nPois vós morrestes,\ne a vossa vida está escondida, com Cristo, em Deus.\nQuando Cristo, vossa vida, aparecer em seu triunfo,\nentão vós aparecereis também com ele,\nrevestidos de glória.\n\nSegunda Leitura:\nSegunda Leitura\n\nEvangelho:\nEvangelho do Dia\nProclamação do Evangelho de Jesus Cristo segundo João\n20,1-9\nNo primeiro dia da semana,\nMaria Madalena foi ao túmulo de Jesus,\nbem de madrugada, quando ainda estava escuro,\ne viu que a pedra tinha sido retirada do túmulo.\nEntão ela saiu correndo\ne foi encontrar Simão Pedro e o outro discípulo,\naquele que Jesus amava,\ne lhes disse:\n\"Tiraram o Senhor do túmulo,\ne não sabemos onde o colocaram\".\nSaíram, então, Pedro e o outro discípulo\ne foram ao túmulo.\nOs dois corriam juntos,\nmas o outro discípulo correu mais depressa que Pedro\ne chegou primeiro ao túmulo.\nOlhando para dentro, viu as faixas de linho no chão,\nmas não entrou.\nChegou também Simão Pedro, que vinha correndo atrás,\ne entrou no túmulo.\nViu as faixas de linho deitadas no chão\ne o pano que tinha estado sobre a cabeça de Jesus,\nnão posto com as faixas,\nmas enrolado num lugar à parte.\nEntão entrou também o outro discípulo,\nque tinha chegado primeiro ao túmulo.\nEle viu, e acreditou.\nDe fato, eles ainda não tinham compreendido a Escritura,\nsegundo a qual ele devia ressuscitar dos mortos.\n\nPalavras Papas:\nAs palavras dos Papas\nHoje ressoa em todo o mundo o anúncio que partiu de Jerusalém há dois mil anos: \"Jesus de Nazaré, o crucificado, ressuscitou!\" [...] Jesus Cristo ressuscitou, e somente Ele é capaz de remover as pedras que fecham o caminho para a vida. De fato, Ele mesmo, o Vivente, é o Caminho: o Caminho da vida, da paz, da reconciliação, da fraternidade. Ele nos abre a passagem, algo humanamente impossível, porque somente Ele tira o pecado do mundo e perdoa os nossos pecados. E sem o perdão de Deus, essa pedra não pode ser removida. Sem o perdão dos pecados, não se consegue sair dos fechamentos, dos preconceitos, das suspeitas mútuas e das presunções, que sempre levam a absolver a si mesmo e acusar os outros. Somente o Cristo Ressuscitado, ao dar-nos o perdão dos pecados, abre o caminho para um mundo renovado. Somente ele nos abre as portas da vida, aquelas portas que fechamos continuamente com as guerras que se alastram pelo mundo. [...] O túmulo de Jesus está aberto e vazio! É aqui que tudo começa. Através desse túmulo vazio passa o novo caminho, o caminho que nenhum de nós, mas somente Deus, poderia abrir: o caminho da vida em meio à morte, o caminho da paz em meio à guerra, o caminho da reconciliação em meio ao ódio, o caminho da fraternidade em meio à inimizade. (Mensagem Urbi et Orbi da Páscoa de 31 de março de 2024)\nOutros eventos na programação:\n"
}