{
  "date": "2025-04-17",
  "formatted_date": "17/04/2025",
  "day_of_week": "Thursday",
  "sections": {
    "leitura_do_dia": [
      "Leitura do Dia",
      "Prima Leitura"
    ],
    "primeira_leitura": [
      "Leitura do Livro do Êxodo",
      "12,1-8.11-14",
      "Naqueles dias,",
      "O Senhor disse a Moisés e a Aarão no Egito:",
      "\"Este mês será para vós o começo dos meses;\nserá o primeiro mês do ano.",
      "Falai a toda a comunidade dos filhos de Israel,\ndizendo:\n'No décimo dia deste mês,\ncada um tome um cordeiro por família,\num cordeiro para cada casa.",
      "Se a família não for bastante numerosa\npara comer um cordeiro,\nconvidará também o vizinho mais próximo,\nde acordo com o número de pessoas.\nDeveis calcular o número de comensais,\nconforme o tamanho do cordeiro.",
      "O cordeiro será sem defeito,\nmacho, de um ano.\nPodereis escolher tanto um cordeiro, como um cabrito:",
      "e devereis guardá-lo preso\naté ao dia catorze deste mês.\nEntão toda a comunidade de Israel reunida\no imolará ao cair da tarde.",
      "Tomareis um pouco do seu sangue\ne untareis os marcos e a travessa da porta,\nnas casas em que o comerdes.",
      "Comereis a carne nessa mesma noite, assada ao fogo,\ncom pães ázimos e ervas amargas.",
      "Assim devereis comê-lo: com os rins cingidos,\nsandálias nos pés e cajado na mão.\nE comereis às pressas, pois é a Páscoa,\nisto é, a 'Passagem' do Senhor!",
      "E naquela noite passarei pela terra do Egito\ne ferirei na terra do Egito todos os primogênitos,\ndesde os homens até os animais;\ne infligirei castigos contra todos os deuses do Egito,\neu, o Senhor.",
      "O sangue servirá de sinal nas casas onde estiverdes.\nAo ver o sangue, passarei adiante,\ne não vos atingirá a praga exterminadora,\nquando eu ferir a terra do Egito.",
      "Este dia será para vós uma festa memorável\nem honra do Senhor,\nque haveis de celebrar por todas as gerações,\ncomo instituição perpétua\"."
    ],
    "segunda_leitura": [
      "Segunda Leitura",
      "Leitura da Primeira Carta de São Paulo aos Coríntios",
      "11,23-26",
      "Irmãos:",
      "O que eu recebi do Senhor,\nfoi isso que eu vos transmiti:\nNa noite em que foi entregue,\no Senhor Jesus tomou o pão",
      "e, depois de dar graças, partiu-o e disse:\n\"Isto é o meu corpo que é dado por vós.\nFazei isto em minha memória\".",
      "Do mesmo modo, depois da ceia,\ntomou também o cálice e disse:\n\"Este cálice é a nova aliança, em meu sangue.\nTodas as vezes que dele beberdes,\nfazei isto em minha memória\".",
      "Todas as vezes, de fato, que comerdes deste pão\ne beberdes deste cálice,\nestareis proclamando a morte do Senhor,\naté que ele venha."
    ],
    "evangelho": [
      "Evangelho do Dia",
      "Proclamação do Evangelho de Jesus Cristo segundo João",
      "13,1-15",
      "Era antes da festa da Páscoa.\nJesus sabia que tinha chegado a sua hora\nde passar deste mundo para o Pai;\ntendo amado os seus que estavam no mundo,\namou-os até o fim.",
      "Estavam tomando a ceia.\nO diabo já tinha posto\nno coração de Judas, filho de Simão Iscariotes,\no propósito de entregar Jesus.",
      "Jesus, sabendo que o Pai tinha colocado tudo em suas mãos\ne que de Deus tinha saído e para Deus voltava,",
      "levantou-se da mesa, tirou o manto,\npegou uma toalha e amarrou-a na cintura.",
      "Derramou água numa bacia\ne começou a lavar os pés dos discípulos,\nenxugando-os com a toalha com que estava cingido.",
      "Chegou a vez de Simão Pedro.\nPedro disse:\n\"Senhor, tu me lavas os pés?\"",
      "Respondeu Jesus:\n\"Agora, não entendes o que estou fazendo;\nmais tarde compreenderás\".",
      "Disse-lhe Pedro:\n\"Tu nunca me lavarás os pés!\"\nMas Jesus respondeu:\n\"Se eu não te lavar, não terás parte comigo\".",
      "Simão Pedro disse:\n\"Senhor, então lava não somente os meus pés,\nmas também as mãos e a cabeça\".",
      "Jesus respondeu:\n\"Quem já se banhou\nnão precisa lavar senão os pés, porque já está todo limpo.\nTambém vós estais limpos, mas não todos\".",
      "Jesus sabia quem o ia entregar;\npor isso disse:\n\"Nem todos estais limpos\".",
      "Depois de ter lavado os pés dos discípulos,\nJesus vestiu o manto e sentou-se de novo.\nE disse aos discípulos:\n\"Compreendeis o que acabo de fazer?",
      "Vós me chamais Mestre e Senhor,\ne dizeis bem, pois eu o sou.",
      "Portanto, se eu, o Senhor e Mestre,",
      "vos lavei os pés,\ntambém vós deveis lavar os pés uns dos outros.",
      "Dei-vos o exemplo,\npara que façais a mesma coisa que eu fiz\"."
    ],
    "palavras_papas": [
      "As palavras dos Papas",
      "A realidade que vivemos hoje, nesta celebração. O Senhor quer ficar conosco na Eucaristia, e nós tornamo-nos tabernáculos permanentes do Senhor. Trazemos conosco o Senhor, a ponto de Ele próprio nos dizer que, se não comermos o seu Corpo e não bebermos o seu Sangue, não entraremos no Reino dos Céus. Este é o mistério do Pão e do Vinho, do Senhor conosco, em nós, dentro de nós. O serviço: um procedimento que é condição para entrar no Reino dos Céus. Servir, sim; servir a todos. Mas o Senhor, na troca de palavras que teve com Pedro (cf. Jo 13, 6-9), faz-lhe compreender que, para entrar no Reino dos Céus, devemos deixar que o Senhor nos sirva, que o Servo de Deus seja nosso servo. E isto é difícil de compreender. Se não deixo que o Senhor seja o meu servo, que o Senhor me lave, me faça crescer, me perdoe, não entrarei no Reino dos Céus. E o sacerdócio. Hoje quero estreitar a mim os sacerdotes, todos os sacerdotes, desde o último ordenado até ao Papa. Todos somos sacerdotes. Os bispos, todos... Fomos ungidos, ungidos pelo Senhor; ungidos para fazer a Eucaristia, ungidos para servir. (Homilia na Santa Missa In Coena Domini, 9 de abril de 2020)",
      "Outros eventos na programação:"
    ]
  },
  "title": "Palavra do dia",
  "content": "Leitura Do Dia:\nLeitura do Dia\nPrima Leitura\n\nPrimeira Leitura:\nLeitura do Livro do Êxodo\n12,1-8.11-14\nNaqueles dias,\nO Senhor disse a Moisés e a Aarão no Egito:\n\"Este mês será para vós o começo dos meses;\nserá o primeiro mês do ano.\nFalai a toda a comunidade dos filhos de Israel,\ndizendo:\n'No décimo dia deste mês,\ncada um tome um cordeiro por família,\num cordeiro para cada casa.\nSe a família não for bastante numerosa\npara comer um cordeiro,\nconvidará também o vizinho mais próximo,\nde acordo com o número de pessoas.\nDeveis calcular o número de comensais,\nconforme o tamanho do cordeiro.\nO cordeiro será sem defeito,\nmacho, de um ano.\nPodereis escolher tanto um cordeiro, como um cabrito:\ne devereis guardá-lo preso\naté ao dia catorze deste mês.\nEntão toda a comunidade de Israel reunida\no imolará ao cair da tarde.\nTomareis um pouco do seu sangue\ne untareis os marcos e a travessa da porta,\nnas casas em que o comerdes.\nComereis a carne nessa mesma noite, assada ao fogo,\ncom pães ázimos e ervas amargas.\nAssim devereis comê-lo: com os rins cingidos,\nsandálias nos pés e cajado na mão.\nE comereis às pressas, pois é a Páscoa,\nisto é, a 'Passagem' do Senhor!\nE naquela noite passarei pela terra do Egito\ne ferirei na terra do Egito todos os primogênitos,\ndesde os homens até os animais;\ne infligirei castigos contra todos os deuses do Egito,\neu, o Senhor.\nO sangue servirá de sinal nas casas onde estiverdes.\nAo ver o sangue, passarei adiante,\ne não vos atingirá a praga exterminadora,\nquando eu ferir a terra do Egito.\nEste dia será para vós uma festa memorável\nem honra do Senhor,\nque haveis de celebrar por todas as gerações,\ncomo instituição perpétua\".\n\nSegunda Leitura:\nSegunda Leitura\nLeitura da Primeira Carta de São Paulo aos Coríntios\n11,23-26\nIrmãos:\nO que eu recebi do Senhor,\nfoi isso que eu vos transmiti:\nNa noite em que foi entregue,\no Senhor Jesus tomou o pão\ne, depois de dar graças, partiu-o e disse:\n\"Isto é o meu corpo que é dado por vós.\nFazei isto em minha memória\".\nDo mesmo modo, depois da ceia,\ntomou também o cálice e disse:\n\"Este cálice é a nova aliança, em meu sangue.\nTodas as vezes que dele beberdes,\nfazei isto em minha memória\".\nTodas as vezes, de fato, que comerdes deste pão\ne beberdes deste cálice,\nestareis proclamando a morte do Senhor,\naté que ele venha.\n\nEvangelho:\nEvangelho do Dia\nProclamação do Evangelho de Jesus Cristo segundo João\n13,1-15\nEra antes da festa da Páscoa.\nJesus sabia que tinha chegado a sua hora\nde passar deste mundo para o Pai;\ntendo amado os seus que estavam no mundo,\namou-os até o fim.\nEstavam tomando a ceia.\nO diabo já tinha posto\nno coração de Judas, filho de Simão Iscariotes,\no propósito de entregar Jesus.\nJesus, sabendo que o Pai tinha colocado tudo em suas mãos\ne que de Deus tinha saído e para Deus voltava,\nlevantou-se da mesa, tirou o manto,\npegou uma toalha e amarrou-a na cintura.\nDerramou água numa bacia\ne começou a lavar os pés dos discípulos,\nenxugando-os com a toalha com que estava cingido.\nChegou a vez de Simão Pedro.\nPedro disse:\n\"Senhor, tu me lavas os pés?\"\nRespondeu Jesus:\n\"Agora, não entendes o que estou fazendo;\nmais tarde compreenderás\".\nDisse-lhe Pedro:\n\"Tu nunca me lavarás os pés!\"\nMas Jesus respondeu:\n\"Se eu não te lavar, não terás parte comigo\".\nSimão Pedro disse:\n\"Senhor, então lava não somente os meus pés,\nmas também as mãos e a cabeça\".\nJesus respondeu:\n\"Quem já se banhou\nnão precisa lavar senão os pés, porque já está todo limpo.\nTambém vós estais limpos, mas não todos\".\nJesus sabia quem o ia entregar;\npor isso disse:\n\"Nem todos estais limpos\".\nDepois de ter lavado os pés dos discípulos,\nJesus vestiu o manto e sentou-se de novo.\nE disse aos discípulos:\n\"Compreendeis o que acabo de fazer?\nVós me chamais Mestre e Senhor,\ne dizeis bem, pois eu o sou.\nPortanto, se eu, o Senhor e Mestre,\nvos lavei os pés,\ntambém vós deveis lavar os pés uns dos outros.\nDei-vos o exemplo,\npara que façais a mesma coisa que eu fiz\".\n\nPalavras Papas:\nAs palavras dos Papas\nA realidade que vivemos hoje, nesta celebração. O Senhor quer ficar conosco na Eucaristia, e nós tornamo-nos tabernáculos permanentes do Senhor. Trazemos conosco o Senhor, a ponto de Ele próprio nos dizer que, se não comermos o seu Corpo e não bebermos o seu Sangue, não entraremos no Reino dos Céus. Este é o mistério do Pão e do Vinho, do Senhor conosco, em nós, dentro de nós. O serviço: um procedimento que é condição para entrar no Reino dos Céus. Servir, sim; servir a todos. Mas o Senhor, na troca de palavras que teve com Pedro (cf. Jo 13, 6-9), faz-lhe compreender que, para entrar no Reino dos Céus, devemos deixar que o Senhor nos sirva, que o Servo de Deus seja nosso servo. E isto é difícil de compreender. Se não deixo que o Senhor seja o meu servo, que o Senhor me lave, me faça crescer, me perdoe, não entrarei no Reino dos Céus. E o sacerdócio. Hoje quero estreitar a mim os sacerdotes, todos os sacerdotes, desde o último ordenado até ao Papa. Todos somos sacerdotes. Os bispos, todos... Fomos ungidos, ungidos pelo Senhor; ungidos para fazer a Eucaristia, ungidos para servir. (Homilia na Santa Missa In Coena Domini, 9 de abril de 2020)\nOutros eventos na programação:\n"
}