{
  "date": "2025-04-06",
  "formatted_date": "06/04/2025",
  "day_of_week": "Sunday",
  "sections": {
    "leitura_do_dia": [
      "Leitura do Dia"
    ],
    "primeira_leitura": [
      "Primeira Leitura",
      "Leitura do Livro do Profeta Isaías",
      "43,16-21",
      "Isto diz o Senhor,\nque abriu uma passagem no mar\ne um caminho entre águas impetuosas;",
      "que pôs a perder carros e cavalos,\ntropas e homens corajosos;\npois estão todos mortos e não ressuscitarão,\nforam abafados como mecha de pano e apagaram-se:",
      "\"Não relembreis coisas passadas,\nnão olheis para fatos antigos.",
      "Eis que eu farei coisas novas,\ne que já estão surgindo:",
      "acaso não as reconheceis?\nPois abrirei uma estrada no deserto\ne farei correr rios na terra seca.",
      "Hão de glorificar-me os animais selvagens,\nos dragões e os avestruzes,\nporque fiz brotar água no deserto\ne rios na terra seca\npara dar de beber a meu povo, a meus escolhidos.",
      "Este povo, eu o criei para mim\ne ele cantará meus louvores\".",
      "Leitura da Carta de São Paulo aos Filipenses",
      "3,8-14",
      "Irmãos:",
      "Na verdade, considero tudo como perda\ndiante da vantagem suprema\nque consiste em conhecer a Cristo Jesus, meu Senhor.\nPor causa dele eu perdi tudo.\nConsidero tudo como lixo,\npara ganhar Cristo e ser encontrado unido a ele;",
      "não com minha justiça provindo da Lei,\nmas com a justiça por meio da fé em Cristo,\na justiça que vem de Deus, na base da fé.",
      "Esta consiste em conhecer a Cristo,\nexperimentar a força da sua ressurreição,\nficar em comunhão com os seus sofrimentos,\ntornando-me semelhante a ele na sua morte,",
      "para ver se alcanço a ressurreição dentre os mortos.",
      "Não que já tenha recebido tudo isso,\nou que já seja perfeito.\nMas corro para alcançá-lo,\nvisto que já fui alcançado por Cristo Jesus.",
      "Irmãos, eu não julgo já tê-lo alcançado.\nUma coisa, porém, eu faço:\nesquecendo o que fica para trás,\neu me lanço para o que está na frente.",
      "Corro direto para a meta,\nrumo ao prêmio,\nque, do alto, Deus me chama a receber\nem Cristo Jesus."
    ],
    "segunda_leitura": [
      "Segunda Leitura"
    ],
    "evangelho": [
      "Evangelho do Dia",
      "Proclamação do Evangelho de Jesus Cristo segundo João",
      "8,1-11",
      "Naquele tempo,",
      "Jesus foi para o monte das Oliveiras.",
      "De madrugada, voltou de novo ao Templo.\nTodo o povo se reuniu em volta dele.\nSentando-se, começou a ensiná-los.",
      "Entretanto, os mestres da Lei e os fariseus\ntrouxeram uma mulher surpreendida em adultério.\nColocando-a no meio deles,",
      "disseram a Jesus:",
      "\"Mestre, esta mulher foi surpreendida em flagrante adultério.",
      "Moisés na Lei mandou apedrejar tais mulheres.\nQue dizes tu?\"",
      "Perguntavam isso para experimentar Jesus\ne para terem motivo de o acusar.\nMas Jesus, inclinando-se,\ncomeçou a escrever com o dedo no chão.",
      "Como persistissem em interrogá-lo,\nJesus ergueu-se e disse:",
      "\"Quem dentre vós não tiver pecado,\nseja o primeiro a atirar-lhe uma pedra\".",
      "E tornando a inclinar-se,\ncontinuou a escrever no chão.",
      "E eles, ouvindo o que Jesus falou,\nforam saindo um a um,\na começar pelos mais velhos;\ne Jesus ficou sozinho,\ncom a mulher que estava lá, no meio do povo.",
      "Então Jesus se levantou e disse:\n\"Mulher, onde estão eles?\nNinguém te condenou?\"",
      "Ela respondeu: \"Ninguém, Senhor\".\nEntão Jesus lhe disse:",
      "\"Eu também não te condeno.\nPodes ir, e de agora em diante não peques mais\"."
    ],
    "palavras_papas": [
      "As palavras dos Papas",
      "E Jesus despede a mulher com estas palavras maravilhosas: «Vai e de agora em diante não tornes a pecar» (v. 11). E assim Jesus abre diante dela um caminho novo, criado pela misericórdia, uma vereda que exige o seu compromisso de não voltar a pecar. Trata-se de um convite válido para cada um de nós: quando nos perdoa, Jesus abre-nos sempre um caminho novo para irmos em frente. Neste tempo de Quaresma, somos chamados a reconhecer-nos pecadores e a pedir perdão a Deus. E o perdão, por sua vez, enquanto nos reconcilia e nos concede a paz, leva-nos a recomeçar uma história renovada. Toda a verdadeira conversão visa um futuro novo, um caminho novo, uma vida boa, uma vida livre do pecado, uma vida generosa. Não tenhamos medo de pedir perdão a Jesus, porque Ele nos abre a porta para esta vida nova. A Virgem Maria nos ajude a testemunhar a todos o amor misericordioso de Deus que, em Jesus, nos perdoa e renova a nossa existência, oferecendo-nos sempre renovadas possibilidades. (Angelus de 7 de abril de 2019)",
      "Outros eventos na programação:"
    ]
  },
  "title": "Palavra do dia",
  "content": "Leitura Do Dia:\nLeitura do Dia\n\nPrimeira Leitura:\nPrimeira Leitura\nLeitura do Livro do Profeta Isaías\n43,16-21\nIsto diz o Senhor,\nque abriu uma passagem no mar\ne um caminho entre águas impetuosas;\nque pôs a perder carros e cavalos,\ntropas e homens corajosos;\npois estão todos mortos e não ressuscitarão,\nforam abafados como mecha de pano e apagaram-se:\n\"Não relembreis coisas passadas,\nnão olheis para fatos antigos.\nEis que eu farei coisas novas,\ne que já estão surgindo:\nacaso não as reconheceis?\nPois abrirei uma estrada no deserto\ne farei correr rios na terra seca.\nHão de glorificar-me os animais selvagens,\nos dragões e os avestruzes,\nporque fiz brotar água no deserto\ne rios na terra seca\npara dar de beber a meu povo, a meus escolhidos.\nEste povo, eu o criei para mim\ne ele cantará meus louvores\".\nLeitura da Carta de São Paulo aos Filipenses\n3,8-14\nIrmãos:\nNa verdade, considero tudo como perda\ndiante da vantagem suprema\nque consiste em conhecer a Cristo Jesus, meu Senhor.\nPor causa dele eu perdi tudo.\nConsidero tudo como lixo,\npara ganhar Cristo e ser encontrado unido a ele;\nnão com minha justiça provindo da Lei,\nmas com a justiça por meio da fé em Cristo,\na justiça que vem de Deus, na base da fé.\nEsta consiste em conhecer a Cristo,\nexperimentar a força da sua ressurreição,\nficar em comunhão com os seus sofrimentos,\ntornando-me semelhante a ele na sua morte,\npara ver se alcanço a ressurreição dentre os mortos.\nNão que já tenha recebido tudo isso,\nou que já seja perfeito.\nMas corro para alcançá-lo,\nvisto que já fui alcançado por Cristo Jesus.\nIrmãos, eu não julgo já tê-lo alcançado.\nUma coisa, porém, eu faço:\nesquecendo o que fica para trás,\neu me lanço para o que está na frente.\nCorro direto para a meta,\nrumo ao prêmio,\nque, do alto, Deus me chama a receber\nem Cristo Jesus.\n\nSegunda Leitura:\nSegunda Leitura\n\nEvangelho:\nEvangelho do Dia\nProclamação do Evangelho de Jesus Cristo segundo João\n8,1-11\nNaquele tempo,\nJesus foi para o monte das Oliveiras.\nDe madrugada, voltou de novo ao Templo.\nTodo o povo se reuniu em volta dele.\nSentando-se, começou a ensiná-los.\nEntretanto, os mestres da Lei e os fariseus\ntrouxeram uma mulher surpreendida em adultério.\nColocando-a no meio deles,\ndisseram a Jesus:\n\"Mestre, esta mulher foi surpreendida em flagrante adultério.\nMoisés na Lei mandou apedrejar tais mulheres.\nQue dizes tu?\"\nPerguntavam isso para experimentar Jesus\ne para terem motivo de o acusar.\nMas Jesus, inclinando-se,\ncomeçou a escrever com o dedo no chão.\nComo persistissem em interrogá-lo,\nJesus ergueu-se e disse:\n\"Quem dentre vós não tiver pecado,\nseja o primeiro a atirar-lhe uma pedra\".\nE tornando a inclinar-se,\ncontinuou a escrever no chão.\nE eles, ouvindo o que Jesus falou,\nforam saindo um a um,\na começar pelos mais velhos;\ne Jesus ficou sozinho,\ncom a mulher que estava lá, no meio do povo.\nEntão Jesus se levantou e disse:\n\"Mulher, onde estão eles?\nNinguém te condenou?\"\nEla respondeu: \"Ninguém, Senhor\".\nEntão Jesus lhe disse:\n\"Eu também não te condeno.\nPodes ir, e de agora em diante não peques mais\".\n\nPalavras Papas:\nAs palavras dos Papas\nE Jesus despede a mulher com estas palavras maravilhosas: «Vai e de agora em diante não tornes a pecar» (v. 11). E assim Jesus abre diante dela um caminho novo, criado pela misericórdia, uma vereda que exige o seu compromisso de não voltar a pecar. Trata-se de um convite válido para cada um de nós: quando nos perdoa, Jesus abre-nos sempre um caminho novo para irmos em frente. Neste tempo de Quaresma, somos chamados a reconhecer-nos pecadores e a pedir perdão a Deus. E o perdão, por sua vez, enquanto nos reconcilia e nos concede a paz, leva-nos a recomeçar uma história renovada. Toda a verdadeira conversão visa um futuro novo, um caminho novo, uma vida boa, uma vida livre do pecado, uma vida generosa. Não tenhamos medo de pedir perdão a Jesus, porque Ele nos abre a porta para esta vida nova. A Virgem Maria nos ajude a testemunhar a todos o amor misericordioso de Deus que, em Jesus, nos perdoa e renova a nossa existência, oferecendo-nos sempre renovadas possibilidades. (Angelus de 7 de abril de 2019)\nOutros eventos na programação:\n"
}