{
  "date": "2025-05-11",
  "formatted_date": "11/05/2025",
  "day_of_week": "Sunday",
  "sections": {
    "leitura_do_dia": [
      "Leitura do Dia"
    ],
    "primeira_leitura": [
      "Primeira Leitura",
      "Leitura dos Atos dos Apóstolos",
      "13,14.43-52",
      "Naqueles dias, Paulo e Barnabé",
      "partindo de Perge,chegaram a Antioquia da Pisídia.E, entrando na sinagoga em dia de sábado, sentaram-se.",
      "Muitos judeus e pessoas piedosas",
      "convertidas ao judaísmo seguiram Paulo e Barnabé.Conversando com eles, os dois insistiampara que continuassem fiéis à graça de Deus.",
      "No sábado seguinte, quase toda a cidade se reuniupara ouvir a palavra de Deus.",
      "Ao verem aquela multidão,os judeus ficaram cheios de invejae, com blasfêmias, opunham-se ao que Paulo dizia.",
      "Então, com muita coragem,Paulo e Barnabé declararam:\"Era preciso anunciar a palavra de Deus primeiro a vós.Mas, como a rejeitaise vos considerais indignos da vida eterna,sabei que vamos dirigir-nos aos pagãos.",
      "Porque esta é a ordem que o Senhor nos deu:'Eu te coloquei como luz para as nações,para que leves a salvaçãoaté os confins da terra'\".",
      "Os pagãos ficaram muito contentes,quando ouviram isso,e glorificavam a palavra do Senhor.Todos os que eram destinados à vida eterna,abraçaram a fé.",
      "Desse modo, a palavra do Senhor",
      "espalhava-se por toda a região.",
      "Mas os judeus",
      "instigaram as mulheres ricas e religiosas,assim como os homens influentes da cidade,provocaram uma perseguição contra Paulo e Barnabée expulsaram-nos do seu território.",
      "Então os apóstolos sacudiram contra elesa poeira dos pés, e foram para a cidade de Icônio.",
      "Os discípulos, porém, ficaram cheios de alegriae do Espírito Santo.",
      "Leitura do Livro do Apocalipse de São João",
      "7,9.14b-17",
      "Eu, João,",
      "vi uma multidão imensade gente de todas as nações, tribos, povos e línguas,e que ninguém podia contar.Estavam de pé diante do trono e do Cordeiro;trajavam vestes brancase traziam palmas na mão.",
      "Então um dos anciãos me disse:\"Esses são os que vieram da grande tribulação.Lavaram e alvejaram as suas roupasno sangue do Cordeiro.",
      "Por isso, estão diante do trono de Deuse lhe prestam culto, dia e noite, no seu templo.E aquele que está sentado no tronoos abrigará na sua tenda.",
      "Nunca mais terão fome, nem sede.Nem os molestará o sol, nem algum calor ardente.",
      "Porque o Cordeiro, que está no meio do trono,será o seu pastore os conduzirá às fontes da água da vida.E Deus enxugará as lágrimas de seus olhos\"."
    ],
    "segunda_leitura": [
      "Segunda Leitura"
    ],
    "evangelho": [
      "Evangelho do Dia",
      "Proclamação do Evangelho de Jesus Cristo segundo João",
      "10,27-30",
      "Naquele tempo, disse Jesus:",
      "\"As minhas ovelhas escutam a minha voz,eu as conheço e elas me seguem.",
      "Eu dou-lhes a vida eternae elas jamais se perderão.E ninguém vai arrancá-las de minha mão.",
      "Meu Pai, que me deu estas ovelhas,é maior que todos,e ninguém pode arrebatá-las da mão do Pai.",
      "Eu e o Pai somos um\"."
    ],
    "palavras_papas": [
      "As palavras dos Papas",
      "O Evangelho da Liturgia de hoje fala-nos do vínculo entre o Senhor e cada um de nós (cf. Jo 10, 27-30). Para o fazer, Jesus utiliza uma imagem terna, uma bela imagem, a do pastor que está com as ovelhas. E explica-a com três verbos: «As minhas ovelhas – diz Jesus – ouvem a minha voz, euconheço-as, e elas seguem-me» (v. 27). Três verbos: ouvir, conhecer, seguir. Vejamos estes três verbos.",
      "Em primeiro lugar, as ovelhasouvema voz do pastor. A iniciativa vem sempre do Senhor; tudo tem início na sua graça: é Ele que nos chama à comunhão com Ele. Mas esta comunhão acontece se nos abrirmos à escuta; se continuarmos surdos, ele não nos pode dar esta comunhão. Abrirmo-nos à escuta pois escutar significa disponibilidade, significa docilidade, significa tempo dedicado ao diálogo. (...)",
      "Ouvir Jesus torna-se assim a forma de descobrir que Ele nos conhece. Eis o segundo verbo, que diz respeito ao bom pastor: Ele conhece as suas ovelhas. Mas isto não significa apenas que sabe muitas coisas sobre nós: conhecer no sentido bíblico significa também amar. Significa que o Senhor, enquanto “nos lê dentro”, nos ama, não nos condena. Se o ouvirmos, descobrimos isto, que o Senhor nos ama. A maneira de descobrir o amor do Senhor é ouvi-lo. (...)",
      "Por fim, o terceiro verbo: as ovelhas que ouvem e se descobrem conhecidas seguem: ouvem, sentem-se conhecidas pelo Senhor e seguem o Senhor, que é o seu pastor. E quem segue Cristo, o que faz? Vai para onde Ele vai, na mesma estrada, na mesma direção. (...) interessa-se por aqueles que estão longe, preocupa-se com a situação de quantos sofrem, sabe chorar com aqueles que choram, estende a mão ao próximo, leva-o sobre os ombros. E eu? Deixo-me amar por Jesus e pelo deixar-me amar, ou começo a amá-lo e imitá-lo? Que a Santíssima Virgem nos ajude a ouvir Cristo, a conhecê-lo cada vez mais e a segui-lo no caminho do serviço. Ouvir, conhecê-lo e segui-lo. (Papa Francisco, Regina Caeli de 8 de maio de 2022)",
      "Outros eventos na programação:"
    ]
  },
  "title": "Palavra do dia",
  "content": "Leitura Do Dia: Leitura do Dia Primeira Leitura: Primeira Leitura Leitura dos Atos dos Apóstolos 13,14.43-52 Naqueles dias, Paulo e Barnabé partindo de Perge,chegaram a Antioquia da Pisídia.E, entrando na sinagoga em dia de sábado, sentaram-se. Muitos judeus e pessoas piedosas convertidas ao judaísmo seguiram Paulo e Barnabé.Conversando com eles, os dois insistiampara que continuassem fiéis à graça de Deus. No sábado seguinte, quase toda a cidade se reuniupara ouvir a palavra de Deus. Ao verem aquela multidão,os judeus ficaram cheios de invejae, com blasfêmias, opunham-se ao que Paulo dizia. Então, com muita coragem,Paulo e Barnabé declararam:\"Era preciso anunciar a palavra de Deus primeiro a vós.Mas, como a rejeitaise vos considerais indignos da vida eterna,sabei que vamos dirigir-nos aos pagãos. Porque esta é a ordem que o Senhor nos deu:'Eu te coloquei como luz para as nações,para que leves a salvaçãoaté os confins da terra'\". Os pagãos ficaram muito contentes,quando ouviram isso,e glorificavam a palavra do Senhor.Todos os que eram destinados à vida eterna,abraçaram a fé. Desse modo, a palavra do Senhor espalhava-se por toda a região. Mas os judeus instigaram as mulheres ricas e religiosas,assim como os homens influentes da cidade,provocaram uma perseguição contra Paulo e Barnabée expulsaram-nos do seu território. Então os apóstolos sacudiram contra elesa poeira dos pés, e foram para a cidade de Icônio. Os discípulos, porém, ficaram cheios de alegriae do Espírito Santo. Leitura do Livro do Apocalipse de São João 7,9.14b-17 Eu, João, vi uma multidão imensade gente de todas as nações, tribos, povos e línguas,e que ninguém podia contar.Estavam de pé diante do trono e do Cordeiro;trajavam vestes brancase traziam palmas na mão. Então um dos anciãos me disse:\"Esses são os que vieram da grande tribulação.Lavaram e alvejaram as suas roupasno sangue do Cordeiro. Por isso, estão diante do trono de Deuse lhe prestam culto, dia e noite, no seu templo.E aquele que está sentado no tronoos abrigará na sua tenda. Nunca mais terão fome, nem sede.Nem os molestará o sol, nem algum calor ardente. Porque o Cordeiro, que está no meio do trono,será o seu pastore os conduzirá às fontes da água da vida.E Deus enxugará as lágrimas de seus olhos\". Segunda Leitura: Segunda Leitura Evangelho: Evangelho do Dia Proclamação do Evangelho de Jesus Cristo segundo João 10,27-30 Naquele tempo, disse Jesus: \"As minhas ovelhas escutam a minha voz,eu as conheço e elas me seguem. Eu dou-lhes a vida eternae elas jamais se perderão.E ninguém vai arrancá-las de minha mão. Meu Pai, que me deu estas ovelhas,é maior que todos,e ninguém pode arrebatá-las da mão do Pai. Eu e o Pai somos um\". Palavras Papas: As palavras dos Papas O Evangelho da Liturgia de hoje fala-nos do vínculo entre o Senhor e cada um de nós (cf. Jo 10, 27-30). Para o fazer, Jesus utiliza uma imagem terna, uma bela imagem, a do pastor que está com as ovelhas. E explica-a com três verbos: «As minhas ovelhas – diz Jesus – ouvem a minha voz, euconheço-as, e elas seguem-me» (v. 27). Três verbos: ouvir, conhecer, seguir. Vejamos estes três verbos. Em primeiro lugar, as ovelhasouvema voz do pastor. A iniciativa vem sempre do Senhor; tudo tem início na sua graça: é Ele que nos chama à comunhão com Ele. Mas esta comunhão acontece se nos abrirmos à escuta; se continuarmos surdos, ele não nos pode dar esta comunhão. Abrirmo-nos à escuta pois escutar significa disponibilidade, significa docilidade, significa tempo dedicado ao diálogo. (...) Ouvir Jesus torna-se assim a forma de descobrir que Ele nos conhece. Eis o segundo verbo, que diz respeito ao bom pastor: Ele conhece as suas ovelhas. Mas isto não significa apenas que sabe muitas coisas sobre nós: conhecer no sentido bíblico significa também amar. Significa que o Senhor, enquanto “nos lê dentro”, nos ama, não nos condena. Se o ouvirmos, descobrimos isto, que o Senhor nos ama. A maneira de descobrir o amor do Senhor é ouvi-lo. (...) Por fim, o terceiro verbo: as ovelhas que ouvem e se descobrem conhecidas seguem: ouvem, sentem-se conhecidas pelo Senhor e seguem o Senhor, que é o seu pastor. E quem segue Cristo, o que faz? Vai para onde Ele vai, na mesma estrada, na mesma direção. (...) interessa-se por aqueles que estão longe, preocupa-se com a situação de quantos sofrem, sabe chorar com aqueles que choram, estende a mão ao próximo, leva-o sobre os ombros. E eu? Deixo-me amar por Jesus e pelo deixar-me amar, ou começo a amá-lo e imitá-lo? Que a Santíssima Virgem nos ajude a ouvir Cristo, a conhecê-lo cada vez mais e a segui-lo no caminho do serviço. Ouvir, conhecê-lo e segui-lo. (Papa Francisco, Regina Caeli de 8 de maio de 2022) Outros eventos na programação:"
}