{
  "date": "2025-05-25",
  "formatted_date": "25/05/2025",
  "day_of_week": "Sunday",
  "sections": {
    "leitura_do_dia": [
      "Leitura do Dia"
    ],
    "primeira_leitura": [
      "Primeira Leitura",
      "Leitura dos Atos dos Apóstolos",
      "15,1-2.22-29",
      "Naqueles dias:",
      "Chegaram alguns da Judeia\ne ensinavam aos irmãos de Antioquia, dizendo:\n\"Vós não podereis salvar-vos,\nse não fordes circuncidados,\ncomo ordena a Lei de Moisés\":",
      "Isto provocou muita confusão, e houve\numa grande discussão de Paulo e Barnabé com eles.\nFinalmente, decidiram que Paulo, Barnabé\ne alguns outros fossem a Jerusalém,\npara tratar dessa questão\ncom os apóstolos e os anciãos.",
      "Então os apóstolos e os anciãos,\nde acordo com toda a comunidade de Jerusalém,\nresolveram escolher alguns da comunidade\npara mandá-los a Antioquia, com Paulo e Barnabé.\nEscolheram Judas, chamado Bársabas, e Silas,\nque eram muito respeitados pelos irmãos.",
      "Ficamos sabendo que alguns dos nossos\ncausaram perturbações com palavras\nque transtornaram vosso espírito.\nEles não foram enviados por nós.",
      "Então decidimos, de comum acordo,\nescolher alguns representantes\ne mandá-los até vós,\njunto com nossos queridos irmãos Barnabé e Paulo,",
      "homens que arriscaram suas vidas\npelo nome de nosso Senhor Jesus Cristo.",
      "Por isso, estamos enviando Judas e Silas,\nque pessoalmente vos transmitirão a mesma mensagem.",
      "Porque decidimos, o Espírito Santo e nós,\nnão vos impor nenhum fardo,\nalém destas coisas indispensáveis:",
      "abster-se de carnes sacrificadas aos ídolos,\ndo sangue, das carnes de animais sufocados\ne das uniões ilegítimas.\nVós fareis bem se evitardes essas coisas.\nSaudações!\"",
      "Leitura do Livro do Apocalipse de São João",
      "21,10-14.22-23",
      "Um anjo me levou em espírito\na uma montanha grande e alta.\nMostrou-me a cidade santa, Jerusalém,\ndescendo do céu, de junto de Deus,",
      "brilhando com a glória de Deus.\nSeu brilho era como o de uma pedra preciosíssima,\ncomo o brilho de jaspe cristalino.",
      "Estava cercada por uma muralha maciça e alta,\ncom doze portas.\nSobre as portas estavam doze anjos,\ne nas portas estavam escritos os nomes\ndas doze tribos de Israel.",
      "Havia três portas do lado do oriente,\ntrês portas do lado norte,\ntrês portas do lado sul\ne três portas do lado do ocidente.",
      "A muralha da cidade tinha doze alicerces,\ne sobre eles estavam escritos\nos nomes dos doze apóstolos do Cordeiro.",
      "Não vi templo na cidade,\npois o seu Templo é o próprio Senhor,\no Deus Todo-poderoso, e o Cordeiro.",
      "A cidade não precisa de sol,\nnem de lua que a iluminem,\npois a glória de Deus é a sua luz\ne a sua lâmpada é o Cordeiro."
    ],
    "segunda_leitura": [
      "Segunda Leitura"
    ],
    "evangelho": [
      "Evangelho do Dia",
      "Proclamação do Evangelho de Jesus Cristo segundo João",
      "14,23-29",
      "Naquele tempo, disse Jesus a seus discípulos:",
      "\"Se alguém me ama,\nguardará a minha palavra,\ne o meu Pai o amará,\ne nós viremos e faremos nele a nossa morada.",
      "Quem não me ama,\nnão guarda a minha palavra.\nE a palavra que escutais não é minha,\nmas do Pai que me enviou.",
      "Isso é o que vos disse enquanto estava convosco.",
      "Deixo-vos a paz,\na minha paz vos dou;\nmas não a dou como o mundo.\nNão se perturbe nem se intimide o vosso coração.",
      "Ouvistes que eu vos disse:\n'Vou, mas voltarei a vós'.\nSe me amásseis,\nficaríeis alegres porque vou para o Pai,\npois o Pai é maior do que eu.",
      "Disse-vos isto, agora, antes que aconteça,\npara que, quando acontecer,\nvós acrediteis\"."
    ],
    "palavras_papas": [
      "As palavras dos Papas",
      "A paz que Jesus traz é o dom da salvação que Ele tinha prometido durante os seus discursos de despedida: «Deixo-vos a Minha paz, a Minha paz vos dou. Mas não vo-la dou como o mundo a dá. Não se perturbe o vosso coração e não receeis» (Jo 14, 27). Neste dia de Ressurreição, Ele concede-a em plenitude e ela torna-se para a comunidade fonte de alegria, certeza de vitória, segurança ao apoiar-se em Deus. «Não se perturbe o vosso coração e não tenhais medo» (Jo 14, 1) diz também a nós. Depois desta saudação, Jesus mostra aos discípulos as feridas das mãos e do lado (cf. Jo 20, 20), sinais do que foi e que nunca mais se cancelará: a sua humanidade gloriosa permanece «ferida». Este gesto tem a finalidade de confirmar a nova realidade da Ressurreição: o Cristo que agora está entre os seus é uma pessoa real, o mesmo Jesus que três dias antes foi pregado na cruz. E é assim que, na luz resplandecente da Páscoa, no encontro com o Ressuscitado, os discípulos captam o sentido salvífico da sua paixão e morte. Então, da tristeza e do medo passam para a alegria plena. A tristeza e as próprias feridas tornam-se fonte de alegria. A alegria que nasce no coração deles é originada pela «visão do Senhor» (Jo 20, 20). Ele diz-lhe novamente: «A paz seja convosco» (v. 21). Agora é evidente que não é só uma saudação. É um dom, o dom que o Ressuscitado deseja fazer aos seus amigos, e é ao mesmo tempo uma recomendação: esta paz, adquirida por Cristo com o seu sangue, é para eles mas também para todos, e os discípulos deverão levá-la a todo o mundo. (\nPapa Bento XVI, Audiência Geral de 11 de abril de 2012\n)",
      "Outros eventos na programação:"
    ]
  },
  "title": "Palavra do dia",
  "content": "Leitura Do Dia:\nLeitura do Dia\n\nPrimeira Leitura:\nPrimeira Leitura\nLeitura dos Atos dos Apóstolos\n15,1-2.22-29\nNaqueles dias:\nChegaram alguns da Judeia\ne ensinavam aos irmãos de Antioquia, dizendo:\n\"Vós não podereis salvar-vos,\nse não fordes circuncidados,\ncomo ordena a Lei de Moisés\":\nIsto provocou muita confusão, e houve\numa grande discussão de Paulo e Barnabé com eles.\nFinalmente, decidiram que Paulo, Barnabé\ne alguns outros fossem a Jerusalém,\npara tratar dessa questão\ncom os apóstolos e os anciãos.\nEntão os apóstolos e os anciãos,\nde acordo com toda a comunidade de Jerusalém,\nresolveram escolher alguns da comunidade\npara mandá-los a Antioquia, com Paulo e Barnabé.\nEscolheram Judas, chamado Bársabas, e Silas,\nque eram muito respeitados pelos irmãos.\nFicamos sabendo que alguns dos nossos\ncausaram perturbações com palavras\nque transtornaram vosso espírito.\nEles não foram enviados por nós.\nEntão decidimos, de comum acordo,\nescolher alguns representantes\ne mandá-los até vós,\njunto com nossos queridos irmãos Barnabé e Paulo,\nhomens que arriscaram suas vidas\npelo nome de nosso Senhor Jesus Cristo.\nPor isso, estamos enviando Judas e Silas,\nque pessoalmente vos transmitirão a mesma mensagem.\nPorque decidimos, o Espírito Santo e nós,\nnão vos impor nenhum fardo,\nalém destas coisas indispensáveis:\nabster-se de carnes sacrificadas aos ídolos,\ndo sangue, das carnes de animais sufocados\ne das uniões ilegítimas.\nVós fareis bem se evitardes essas coisas.\nSaudações!\"\nLeitura do Livro do Apocalipse de São João\n21,10-14.22-23\nUm anjo me levou em espírito\na uma montanha grande e alta.\nMostrou-me a cidade santa, Jerusalém,\ndescendo do céu, de junto de Deus,\nbrilhando com a glória de Deus.\nSeu brilho era como o de uma pedra preciosíssima,\ncomo o brilho de jaspe cristalino.\nEstava cercada por uma muralha maciça e alta,\ncom doze portas.\nSobre as portas estavam doze anjos,\ne nas portas estavam escritos os nomes\ndas doze tribos de Israel.\nHavia três portas do lado do oriente,\ntrês portas do lado norte,\ntrês portas do lado sul\ne três portas do lado do ocidente.\nA muralha da cidade tinha doze alicerces,\ne sobre eles estavam escritos\nos nomes dos doze apóstolos do Cordeiro.\nNão vi templo na cidade,\npois o seu Templo é o próprio Senhor,\no Deus Todo-poderoso, e o Cordeiro.\nA cidade não precisa de sol,\nnem de lua que a iluminem,\npois a glória de Deus é a sua luz\ne a sua lâmpada é o Cordeiro.\n\nSegunda Leitura:\nSegunda Leitura\n\nEvangelho:\nEvangelho do Dia\nProclamação do Evangelho de Jesus Cristo segundo João\n14,23-29\nNaquele tempo, disse Jesus a seus discípulos:\n\"Se alguém me ama,\nguardará a minha palavra,\ne o meu Pai o amará,\ne nós viremos e faremos nele a nossa morada.\nQuem não me ama,\nnão guarda a minha palavra.\nE a palavra que escutais não é minha,\nmas do Pai que me enviou.\nIsso é o que vos disse enquanto estava convosco.\nDeixo-vos a paz,\na minha paz vos dou;\nmas não a dou como o mundo.\nNão se perturbe nem se intimide o vosso coração.\nOuvistes que eu vos disse:\n'Vou, mas voltarei a vós'.\nSe me amásseis,\nficaríeis alegres porque vou para o Pai,\npois o Pai é maior do que eu.\nDisse-vos isto, agora, antes que aconteça,\npara que, quando acontecer,\nvós acrediteis\".\n\nPalavras Papas:\nAs palavras dos Papas\nA paz que Jesus traz é o dom da salvação que Ele tinha prometido durante os seus discursos de despedida: «Deixo-vos a Minha paz, a Minha paz vos dou. Mas não vo-la dou como o mundo a dá. Não se perturbe o vosso coração e não receeis» (Jo 14, 27). Neste dia de Ressurreição, Ele concede-a em plenitude e ela torna-se para a comunidade fonte de alegria, certeza de vitória, segurança ao apoiar-se em Deus. «Não se perturbe o vosso coração e não tenhais medo» (Jo 14, 1) diz também a nós. Depois desta saudação, Jesus mostra aos discípulos as feridas das mãos e do lado (cf. Jo 20, 20), sinais do que foi e que nunca mais se cancelará: a sua humanidade gloriosa permanece «ferida». Este gesto tem a finalidade de confirmar a nova realidade da Ressurreição: o Cristo que agora está entre os seus é uma pessoa real, o mesmo Jesus que três dias antes foi pregado na cruz. E é assim que, na luz resplandecente da Páscoa, no encontro com o Ressuscitado, os discípulos captam o sentido salvífico da sua paixão e morte. Então, da tristeza e do medo passam para a alegria plena. A tristeza e as próprias feridas tornam-se fonte de alegria. A alegria que nasce no coração deles é originada pela «visão do Senhor» (Jo 20, 20). Ele diz-lhe novamente: «A paz seja convosco» (v. 21). Agora é evidente que não é só uma saudação. É um dom, o dom que o Ressuscitado deseja fazer aos seus amigos, e é ao mesmo tempo uma recomendação: esta paz, adquirida por Cristo com o seu sangue, é para eles mas também para todos, e os discípulos deverão levá-la a todo o mundo. (\nPapa Bento XVI, Audiência Geral de 11 de abril de 2012\n)\nOutros eventos na programação:\n"
}