{
  "date": "2025-05-11",
  "formatted_date": "11/05/2025",
  "day_of_week": "Sunday",
  "sections": {
    "leitura_do_dia": [
      "Leitura do Dia"
    ],
    "primeira_leitura": [
      "Primeira Leitura",
      "Leitura dos Atos dos Apóstolos",
      "13,14.43-52",
      "Naqueles dias, Paulo e Barnabé",
      "partindo de Perge,\nchegaram a Antioquia da Pisídia.\nE, entrando na sinagoga em dia de sábado, sentaram-se.",
      "Muitos judeus e pessoas piedosas",
      "convertidas ao judaísmo seguiram Paulo e Barnabé.\nConversando com eles, os dois insistiam\npara que continuassem fiéis à graça de Deus.",
      "No sábado seguinte, quase toda a cidade se reuniu\npara ouvir a palavra de Deus.",
      "Ao verem aquela multidão,\nos judeus ficaram cheios de inveja\ne, com blasfêmias, opunham-se ao que Paulo dizia.",
      "Então, com muita coragem,\nPaulo e Barnabé declararam:\n\"Era preciso anunciar a palavra de Deus primeiro a vós.\nMas, como a rejeitais\ne vos considerais indignos da vida eterna,\nsabei que vamos dirigir-nos aos pagãos.",
      "Porque esta é a ordem que o Senhor nos deu:\n'Eu te coloquei como luz para as nações,\npara que leves a salvação\naté os confins da terra'\".",
      "Os pagãos ficaram muito contentes,\nquando ouviram isso,\ne glorificavam a palavra do Senhor.\nTodos os que eram destinados à vida eterna,\nabraçaram a fé.",
      "Desse modo, a palavra do Senhor",
      "espalhava-se por toda a região.",
      "Mas os judeus",
      "instigaram as mulheres ricas e religiosas,\nassim como os homens influentes da cidade,\nprovocaram uma perseguição contra Paulo e Barnabé\ne expulsaram-nos do seu território.",
      "Então os apóstolos sacudiram contra eles\na poeira dos pés, e foram para a cidade de Icônio.",
      "Os discípulos, porém, ficaram cheios de alegria\ne do Espírito Santo.",
      "Leitura do Livro do Apocalipse de São João",
      "7,9.14b-17",
      "Eu, João,",
      "vi uma multidão imensa\nde gente de todas as nações, tribos, povos e línguas,\ne que ninguém podia contar.\nEstavam de pé diante do trono e do Cordeiro;\ntrajavam vestes brancas\ne traziam palmas na mão.",
      "Então um dos anciãos me disse:\n\"Esses são os que vieram da grande tribulação.\nLavaram e alvejaram as suas roupas\nno sangue do Cordeiro.",
      "Por isso, estão diante do trono de Deus\ne lhe prestam culto, dia e noite, no seu templo.\nE aquele que está sentado no trono\nos abrigará na sua tenda.",
      "Nunca mais terão fome, nem sede.\nNem os molestará o sol, nem algum calor ardente.",
      "Porque o Cordeiro, que está no meio do trono,\nserá o seu pastor\ne os conduzirá às fontes da água da vida.\nE Deus enxugará as lágrimas de seus olhos\"."
    ],
    "segunda_leitura": [
      "Segunda Leitura"
    ],
    "evangelho": [
      "Evangelho do Dia",
      "Proclamação do Evangelho de Jesus Cristo segundo João",
      "10,27-30",
      "Naquele tempo, disse Jesus:",
      "\"As minhas ovelhas escutam a minha voz,\neu as conheço e elas me seguem.",
      "Eu dou-lhes a vida eterna\ne elas jamais se perderão.\nE ninguém vai arrancá-las de minha mão.",
      "Meu Pai, que me deu estas ovelhas,\né maior que todos,\ne ninguém pode arrebatá-las da mão do Pai.",
      "Eu e o Pai somos um\"."
    ],
    "palavras_papas": [
      "As palavras dos Papas",
      "O Evangelho da Liturgia de hoje fala-nos do vínculo entre o Senhor e cada um de nós (cf. Jo 10, 27-30). Para o fazer, Jesus utiliza uma imagem terna, uma bela imagem, a do pastor que está com as ovelhas. E explica-a com três verbos: «As minhas ovelhas – diz Jesus – ouvem a minha voz, eu\nconheço-as\n, e elas seguem-me» (v. 27). Três verbos: ouvir, conhecer, seguir. Vejamos estes três verbos.",
      "Em primeiro lugar, as ovelhas\nouvem\na voz do pastor. A iniciativa vem sempre do Senhor; tudo tem início na sua graça: é Ele que nos chama à comunhão com Ele. Mas esta comunhão acontece se nos abrirmos à escuta; se continuarmos surdos, ele não nos pode dar esta comunhão. Abrirmo-nos à escuta pois escutar significa disponibilidade, significa docilidade, significa tempo dedicado ao diálogo. (...)",
      "Ouvir Jesus torna-se assim a forma de descobrir que Ele nos conhece. Eis o segundo verbo, que diz respeito ao bom pastor: Ele conhece as suas ovelhas. Mas isto não significa apenas que sabe muitas coisas sobre nós: conhecer no sentido bíblico significa também amar. Significa que o Senhor, enquanto “nos lê dentro”, nos ama, não nos condena. Se o ouvirmos, descobrimos isto, que o Senhor nos ama. A maneira de descobrir o amor do Senhor é ouvi-lo. (...)",
      "Por fim, o terceiro verbo: as ovelhas que ouvem e se descobrem conhecidas seguem: ouvem, sentem-se conhecidas pelo Senhor e seguem o Senhor, que é o seu pastor. E quem segue Cristo, o que faz? Vai para onde Ele vai, na mesma estrada, na mesma direção. (...) interessa-se por aqueles que estão longe, preocupa-se com a situação de quantos sofrem, sabe chorar com aqueles que choram, estende a mão ao próximo, leva-o sobre os ombros. E eu? Deixo-me amar por Jesus e pelo deixar-me amar, ou começo a amá-lo e imitá-lo? Que a Santíssima Virgem nos ajude a ouvir Cristo, a conhecê-lo cada vez mais e a segui-lo no caminho do serviço. Ouvir, conhecê-lo e segui-lo. (Papa Francisco, Regina Caeli de 8 de maio de 2022)",
      "Outros eventos na programação:"
    ]
  },
  "title": "Palavra do dia",
  "content": "Leitura Do Dia:\nLeitura do Dia\n\nPrimeira Leitura:\nPrimeira Leitura\nLeitura dos Atos dos Apóstolos\n13,14.43-52\nNaqueles dias, Paulo e Barnabé\npartindo de Perge,\nchegaram a Antioquia da Pisídia.\nE, entrando na sinagoga em dia de sábado, sentaram-se.\nMuitos judeus e pessoas piedosas\nconvertidas ao judaísmo seguiram Paulo e Barnabé.\nConversando com eles, os dois insistiam\npara que continuassem fiéis à graça de Deus.\nNo sábado seguinte, quase toda a cidade se reuniu\npara ouvir a palavra de Deus.\nAo verem aquela multidão,\nos judeus ficaram cheios de inveja\ne, com blasfêmias, opunham-se ao que Paulo dizia.\nEntão, com muita coragem,\nPaulo e Barnabé declararam:\n\"Era preciso anunciar a palavra de Deus primeiro a vós.\nMas, como a rejeitais\ne vos considerais indignos da vida eterna,\nsabei que vamos dirigir-nos aos pagãos.\nPorque esta é a ordem que o Senhor nos deu:\n'Eu te coloquei como luz para as nações,\npara que leves a salvação\naté os confins da terra'\".\nOs pagãos ficaram muito contentes,\nquando ouviram isso,\ne glorificavam a palavra do Senhor.\nTodos os que eram destinados à vida eterna,\nabraçaram a fé.\nDesse modo, a palavra do Senhor\nespalhava-se por toda a região.\nMas os judeus\ninstigaram as mulheres ricas e religiosas,\nassim como os homens influentes da cidade,\nprovocaram uma perseguição contra Paulo e Barnabé\ne expulsaram-nos do seu território.\nEntão os apóstolos sacudiram contra eles\na poeira dos pés, e foram para a cidade de Icônio.\nOs discípulos, porém, ficaram cheios de alegria\ne do Espírito Santo.\nLeitura do Livro do Apocalipse de São João\n7,9.14b-17\nEu, João,\nvi uma multidão imensa\nde gente de todas as nações, tribos, povos e línguas,\ne que ninguém podia contar.\nEstavam de pé diante do trono e do Cordeiro;\ntrajavam vestes brancas\ne traziam palmas na mão.\nEntão um dos anciãos me disse:\n\"Esses são os que vieram da grande tribulação.\nLavaram e alvejaram as suas roupas\nno sangue do Cordeiro.\nPor isso, estão diante do trono de Deus\ne lhe prestam culto, dia e noite, no seu templo.\nE aquele que está sentado no trono\nos abrigará na sua tenda.\nNunca mais terão fome, nem sede.\nNem os molestará o sol, nem algum calor ardente.\nPorque o Cordeiro, que está no meio do trono,\nserá o seu pastor\ne os conduzirá às fontes da água da vida.\nE Deus enxugará as lágrimas de seus olhos\".\n\nSegunda Leitura:\nSegunda Leitura\n\nEvangelho:\nEvangelho do Dia\nProclamação do Evangelho de Jesus Cristo segundo João\n10,27-30\nNaquele tempo, disse Jesus:\n\"As minhas ovelhas escutam a minha voz,\neu as conheço e elas me seguem.\nEu dou-lhes a vida eterna\ne elas jamais se perderão.\nE ninguém vai arrancá-las de minha mão.\nMeu Pai, que me deu estas ovelhas,\né maior que todos,\ne ninguém pode arrebatá-las da mão do Pai.\nEu e o Pai somos um\".\n\nPalavras Papas:\nAs palavras dos Papas\nO Evangelho da Liturgia de hoje fala-nos do vínculo entre o Senhor e cada um de nós (cf. Jo 10, 27-30). Para o fazer, Jesus utiliza uma imagem terna, uma bela imagem, a do pastor que está com as ovelhas. E explica-a com três verbos: «As minhas ovelhas – diz Jesus – ouvem a minha voz, eu\nconheço-as\n, e elas seguem-me» (v. 27). Três verbos: ouvir, conhecer, seguir. Vejamos estes três verbos.\nEm primeiro lugar, as ovelhas\nouvem\na voz do pastor. A iniciativa vem sempre do Senhor; tudo tem início na sua graça: é Ele que nos chama à comunhão com Ele. Mas esta comunhão acontece se nos abrirmos à escuta; se continuarmos surdos, ele não nos pode dar esta comunhão. Abrirmo-nos à escuta pois escutar significa disponibilidade, significa docilidade, significa tempo dedicado ao diálogo. (...)\nOuvir Jesus torna-se assim a forma de descobrir que Ele nos conhece. Eis o segundo verbo, que diz respeito ao bom pastor: Ele conhece as suas ovelhas. Mas isto não significa apenas que sabe muitas coisas sobre nós: conhecer no sentido bíblico significa também amar. Significa que o Senhor, enquanto “nos lê dentro”, nos ama, não nos condena. Se o ouvirmos, descobrimos isto, que o Senhor nos ama. A maneira de descobrir o amor do Senhor é ouvi-lo. (...)\nPor fim, o terceiro verbo: as ovelhas que ouvem e se descobrem conhecidas seguem: ouvem, sentem-se conhecidas pelo Senhor e seguem o Senhor, que é o seu pastor. E quem segue Cristo, o que faz? Vai para onde Ele vai, na mesma estrada, na mesma direção. (...) interessa-se por aqueles que estão longe, preocupa-se com a situação de quantos sofrem, sabe chorar com aqueles que choram, estende a mão ao próximo, leva-o sobre os ombros. E eu? Deixo-me amar por Jesus e pelo deixar-me amar, ou começo a amá-lo e imitá-lo? Que a Santíssima Virgem nos ajude a ouvir Cristo, a conhecê-lo cada vez mais e a segui-lo no caminho do serviço. Ouvir, conhecê-lo e segui-lo. (Papa Francisco, Regina Caeli de 8 de maio de 2022)\nOutros eventos na programação:\n"
}